{
  "schemaVersion": 1,
  "username": "AtParhamAzizi",
  "generatedAt": "2026-10-19T16:47:20.946Z",
  "repositories": [
    {
      "id": 1423490465,
      "name": "graphBackon",
      "fullName": "AtParhamAzizi/graphBackon",
      "owner": "AtParhamAzizi",
      "url": "https://github.com/AtParhamAzizi/graphBackon",
      "description": "make your project UI without AI large model needed",
      "language": "Python",
      "topics": [],
      "stars": 0,
      "forks": 0,
      "updatedAt": "2026-10-17T17:27:51.000Z",
      "pushedAt": "2026-10-17T17:27:46.000Z",
      "archived": false,
      "isFork": false,
      "homepage": null,
      "overview": "PyArch Graph is a local-first Python architecture explorer. A FastAPI backend reads a directory on the machine where it runs, parses Python with the standard-library AST without importing or executing project code, and exposes a typed graph. The frontend is a plain HTML, CSS, and JavaScript application served by FastAPI as a readable 2D file map.",
      "hasReadme": true,
      "readmeUrl": "https://github.com/AtParhamAzizi/graphBackon#readme"
    },
    {
      "id": 1396134072,
      "name": "Local_chatbot",
      "fullName": "AtParhamAzizi/Local_chatbot",
      "owner": "AtParhamAzizi",
      "url": "https://github.com/AtParhamAzizi/Local_chatbot",
      "description": "local RAG based chatbot with administrator dashboard",
      "language": "Python",
      "topics": [],
      "stars": 0,
      "forks": 0,
      "updatedAt": "2026-10-16T19:21:22.000Z",
      "pushedAt": "2026-10-16T19:21:18.000Z",
      "archived": false,
      "isFork": false,
      "homepage": null,
      "overview": "A local, Persian-language retrieval-augmented generation (RAG) chatbot with a user chat interface and an administrator dashboard. It stores question-and-answer records, PDF knowledge-base chunks, chat history, feedback, and application logs in MySQL.",
      "hasReadme": true,
      "readmeUrl": "https://github.com/AtParhamAzizi/Local_chatbot#readme"
    },
    {
      "id": 1417438337,
      "name": "ML-Enginiering-and-fundumentals-projects",
      "fullName": "AtParhamAzizi/ML-Enginiering-and-fundumentals-projects",
      "owner": "AtParhamAzizi",
      "url": "https://github.com/AtParhamAzizi/ML-Enginiering-and-fundumentals-projects",
      "description": "This repository contains my first machine learning projects, covering the fundamental algorithms of machine learning.",
      "language": "Python",
      "topics": [],
      "stars": 0,
      "forks": 0,
      "updatedAt": "2026-10-15T08:47:06.000Z",
      "pushedAt": "2026-10-15T08:47:03.000Z",
      "archived": false,
      "isFork": false,
      "homepage": null,
      "overview": null,
      "hasReadme": false,
      "readmeUrl": "https://github.com/AtParhamAzizi/ML-Enginiering-and-fundumentals-projects#readme"
    },
    {
      "id": 1410059938,
      "name": "jarvisjoon-local-agent",
      "fullName": "AtParhamAzizi/jarvisjoon-local-agent",
      "owner": "AtParhamAzizi",
      "url": "https://github.com/AtParhamAzizi/jarvisjoon-local-agent",
      "description": "totally local agent for every PCs with any confgs",
      "language": "Python",
      "topics": [],
      "stars": 0,
      "forks": 0,
      "updatedAt": "2026-10-15T08:13:48.000Z",
      "pushedAt": "2026-10-15T08:13:44.000Z",
      "archived": false,
      "isFork": false,
      "homepage": null,
      "overview": "JarvisJoon is a local coding assistant using models/gemma-4-E2B-it/. It inspects project files, searches code, checks Git status, and optionally applies changes after you approve each preview. The model proposes actions; application code validates and authorizes them. It starts read-only, uses no cloud API, and cannot execute arbitrary commands.",
      "hasReadme": true,
      "readmeUrl": "https://github.com/AtParhamAzizi/jarvisjoon-local-agent#readme"
    }
  ]
}
